{"domain_id":"AMACS-DOM-000006","label":"Energy, Utilities and Environmental Services","definition":"Energy systems, utility services, environmental protection, waste, resilience, and sustainability.","families":[{"family_id":"AMACS-FAM-000230","label":"Energy Management","capabilities":[["AMACS-CAP-000231","Energy audit"],["AMACS-CAP-000232","Energy-efficiency consulting"],["AMACS-CAP-000233","Building energy benchmarking"],["AMACS-CAP-000234","Energy management system implementation"],["AMACS-CAP-000235","Demand response support"]]},{"family_id":"AMACS-FAM-000236","label":"Renewable and Distributed Energy","capabilities":[["AMACS-CAP-000237","Solar photovoltaic installation"],["AMACS-CAP-000238","Battery energy storage integration"],["AMACS-CAP-000239","Electric vehicle charging installation"],["AMACS-CAP-000240","Microgrid design"],["AMACS-CAP-000241","Renewable energy operations and maintenance"]]},{"family_id":"AMACS-FAM-000242","label":"Water and Wastewater","capabilities":[["AMACS-CAP-000243","Water system operations support"],["AMACS-CAP-000244","Wastewater system operations support"],["AMACS-CAP-000245","Water quality testing"],["AMACS-CAP-000246","Leak detection"],["AMACS-CAP-000247","Utility asset management"]]},{"family_id":"AMACS-FAM-000248","label":"Waste and Recycling","capabilities":[["AMACS-CAP-000249","Solid waste collection"],["AMACS-CAP-000250","Recycling services"],["AMACS-CAP-000251","Construction debris management"],["AMACS-CAP-000252","Hazardous waste management"],["AMACS-CAP-000253","Organic waste management"]]},{"family_id":"AMACS-FAM-000254","label":"Environmental Consulting","capabilities":[["AMACS-CAP-000255","Environmental site assessment"],["AMACS-CAP-000256","Environmental permitting support"],["AMACS-CAP-000257","Wetlands assessment"],["AMACS-CAP-000258","Air quality consulting"],["AMACS-CAP-000259","Environmental compliance monitoring"],["AMACS-CAP-000260","Remediation planning"]]},{"family_id":"AMACS-FAM-000261","label":"Resilience and Sustainability","capabilities":[["AMACS-CAP-000262","Climate resilience planning"],["AMACS-CAP-000263","Sustainability strategy"],["AMACS-CAP-000264","Greenhouse gas inventory"],["AMACS-CAP-000265","Resilience assessment"],["AMACS-CAP-000266","Business continuity planning"]]}]}
