{"domain_id":"AMACS-DOM-000014","label":"Research, Engineering and Scientific Services","definition":"Research, technical analysis, engineering, laboratory, testing, and scientific services.","families":[{"family_id":"AMACS-FAM-000508","label":"Engineering Services","capabilities":[["AMACS-CAP-000509","Civil engineering"],["AMACS-CAP-000510","Electrical engineering"],["AMACS-CAP-000511","Mechanical engineering"],["AMACS-CAP-000512","Structural engineering"],["AMACS-CAP-000513","Environmental engineering"],["AMACS-CAP-000514","Industrial engineering"]]},{"family_id":"AMACS-FAM-000515","label":"Architecture and Design","capabilities":[["AMACS-CAP-000516","Architectural design"],["AMACS-CAP-000517","Interior design"],["AMACS-CAP-000518","Landscape architecture"],["AMACS-CAP-000519","Space planning"],["AMACS-CAP-000520","Building code consulting"]]},{"family_id":"AMACS-FAM-000521","label":"Scientific and Laboratory Services","capabilities":[["AMACS-CAP-000522","Laboratory testing"],["AMACS-CAP-000523","Materials testing"],["AMACS-CAP-000524","Chemical analysis"],["AMACS-CAP-000525","Microbiological testing"],["AMACS-CAP-000526","Field sampling"]]},{"family_id":"AMACS-FAM-000527","label":"Research and Evaluation","capabilities":[["AMACS-CAP-000528","Market research"],["AMACS-CAP-000529","Economic research"],["AMACS-CAP-000530","Program evaluation"],["AMACS-CAP-000531","Survey research"],["AMACS-CAP-000532","Qualitative research"],["AMACS-CAP-000533","Impact analysis"]]},{"family_id":"AMACS-FAM-000534","label":"Geospatial and Surveying","capabilities":[["AMACS-CAP-000535","Land surveying"],["AMACS-CAP-000536","Geographic information system services"],["AMACS-CAP-000537","Remote sensing"],["AMACS-CAP-000538","Drone mapping"],["AMACS-CAP-000539","Cartography"]]},{"family_id":"AMACS-FAM-000540","label":"Technical Inspection and Testing","capabilities":[["AMACS-CAP-000541","Construction inspection"],["AMACS-CAP-000542","Equipment inspection"],["AMACS-CAP-000543","Non-destructive testing"],["AMACS-CAP-000544","Commissioning services"],["AMACS-CAP-000545","Compliance testing"]]}]}
