{"domain_id":"AMACS-DOM-000011","label":"Food, Hospitality and Consumer Services","definition":"Food service, lodging, events, retail support, personal services, and customer-facing operations.","families":[{"family_id":"AMACS-FAM-000418","label":"Food Service and Catering","capabilities":[["AMACS-CAP-000419","Catering"],["AMACS-CAP-000420","Institutional food service"],["AMACS-CAP-000421","Mobile food service"],["AMACS-CAP-000422","Meal preparation"],["AMACS-CAP-000423","Food service management"]]},{"family_id":"AMACS-FAM-000424","label":"Hospitality and Lodging","capabilities":[["AMACS-CAP-000425","Hotel operations support"],["AMACS-CAP-000426","Guest services"],["AMACS-CAP-000427","Hospitality management consulting"],["AMACS-CAP-000428","Housekeeping services"],["AMACS-CAP-000429","Short-term lodging management"]]},{"family_id":"AMACS-FAM-000430","label":"Retail and Merchandising","capabilities":[["AMACS-CAP-000431","Retail operations support"],["AMACS-CAP-000432","Visual merchandising"],["AMACS-CAP-000433","Product demonstration"],["AMACS-CAP-000434","Retail inventory services"],["AMACS-CAP-000435","Pop-up retail management"]]},{"family_id":"AMACS-FAM-000436","label":"Personal and Consumer Services","capabilities":[["AMACS-CAP-000437","Personal concierge services"],["AMACS-CAP-000438","Laundry and linen services"],["AMACS-CAP-000439","Beauty and grooming services"],["AMACS-CAP-000440","Pet care services"],["AMACS-CAP-000441","Consumer repair services"]]},{"family_id":"AMACS-FAM-000442","label":"Travel and Tourism Services","capabilities":[["AMACS-CAP-000443","Travel planning"],["AMACS-CAP-000444","Tour operations"],["AMACS-CAP-000445","Destination management"],["AMACS-CAP-000446","Visitor services"],["AMACS-CAP-000447","Tourism marketing"]]}]}
