{"domain_id":"AMACS-DOM-000009","label":"Finance, Insurance and Capital","definition":"Financing, lending, insurance, investment, financial advisory, and risk-transfer services.","families":[{"family_id":"AMACS-FAM-000341","label":"Commercial Lending","capabilities":[["AMACS-CAP-000342","Working capital lending"],["AMACS-CAP-000343","Equipment financing"],["AMACS-CAP-000344","Commercial real estate lending"],["AMACS-CAP-000345","Contract financing"],["AMACS-CAP-000346","Microenterprise lending"],["AMACS-CAP-000347","Line of credit financing"]]},{"family_id":"AMACS-FAM-000348","label":"Investment and Capital Advisory","capabilities":[["AMACS-CAP-000349","Capital readiness advising"],["AMACS-CAP-000350","Equity investment advisory"],["AMACS-CAP-000351","Investor readiness support"],["AMACS-CAP-000352","Transaction advisory"],["AMACS-CAP-000353","Valuation services"]]},{"family_id":"AMACS-FAM-000354","label":"Insurance Services","capabilities":[["AMACS-CAP-000355","Commercial insurance brokerage"],["AMACS-CAP-000356","Employee benefits brokerage"],["AMACS-CAP-000357","Risk financing advisory"],["AMACS-CAP-000358","Claims support"],["AMACS-CAP-000359","Bonding assistance"]]},{"family_id":"AMACS-FAM-000360","label":"Financial Planning and Advisory","capabilities":[["AMACS-CAP-000361","Business financial planning"],["AMACS-CAP-000362","Retirement plan advisory"],["AMACS-CAP-000363","Treasury management advisory"],["AMACS-CAP-000364","Debt restructuring advisory"],["AMACS-CAP-000365","Financial risk analysis"]]},{"family_id":"AMACS-FAM-000366","label":"Payment and Transaction Services","capabilities":[["AMACS-CAP-000367","Merchant payment services"],["AMACS-CAP-000368","Accounts receivable services"],["AMACS-CAP-000369","Accounts payable services"],["AMACS-CAP-000370","Payment integration"],["AMACS-CAP-000371","Billing administration"]]},{"family_id":"AMACS-FAM-000372","label":"Grant and Incentive Support","capabilities":[["AMACS-CAP-000373","Grant research"],["AMACS-CAP-000374","Grant application development"],["AMACS-CAP-000375","Incentive analysis"],["AMACS-CAP-000376","Incentive compliance support"],["AMACS-CAP-000377","Public finance program navigation"]]}]}
