{"domain_id":"AMACS-DOM-000003","label":"Information Technology and Cybersecurity","definition":"Digital systems, software, data, infrastructure, security, and technology operations.","families":[{"family_id":"AMACS-FAM-000098","label":"Software Engineering","capabilities":[["AMACS-CAP-000099","Custom software development"],["AMACS-CAP-000100","Web application development"],["AMACS-CAP-000101","Mobile application development"],["AMACS-CAP-000102","Application modernization"],["AMACS-CAP-000103","Systems integration"],["AMACS-CAP-000104","Application maintenance"]]},{"family_id":"AMACS-FAM-000105","label":"Cloud and Infrastructure","capabilities":[["AMACS-CAP-000106","Cloud architecture"],["AMACS-CAP-000107","Cloud migration"],["AMACS-CAP-000108","Managed infrastructure services"],["AMACS-CAP-000109","Server administration"],["AMACS-CAP-000110","Network engineering"],["AMACS-CAP-000111","Data center support"]]},{"family_id":"AMACS-FAM-000112","label":"Cybersecurity","capabilities":[["AMACS-CAP-000113","Cybersecurity risk assessment"],["AMACS-CAP-000114","Security operations monitoring"],["AMACS-CAP-000115","Vulnerability assessment"],["AMACS-CAP-000116","Penetration testing"],["AMACS-CAP-000117","Incident response"],["AMACS-CAP-000118","Identity and access management"]]},{"family_id":"AMACS-FAM-000119","label":"Data and Analytics","capabilities":[["AMACS-CAP-000120","Data engineering"],["AMACS-CAP-000121","Business intelligence development"],["AMACS-CAP-000122","Data visualization"],["AMACS-CAP-000123","Predictive analytics"],["AMACS-CAP-000124","Data governance"],["AMACS-CAP-000125","Geospatial data analysis"]]},{"family_id":"AMACS-FAM-000126","label":"IT Support and Managed Services","capabilities":[["AMACS-CAP-000127","Help desk support"],["AMACS-CAP-000128","Endpoint management"],["AMACS-CAP-000129","Managed IT services"],["AMACS-CAP-000130","Technology asset management"],["AMACS-CAP-000131","Backup and recovery management"]]},{"family_id":"AMACS-FAM-000132","label":"Digital Experience and Accessibility","capabilities":[["AMACS-CAP-000133","User experience design"],["AMACS-CAP-000134","User interface design"],["AMACS-CAP-000135","Digital accessibility assessment"],["AMACS-CAP-000136","Website accessibility remediation"],["AMACS-CAP-000137","Content management system implementation"]]},{"family_id":"AMACS-FAM-000138","label":"Emerging Technology","capabilities":[["AMACS-CAP-000139","Artificial intelligence solution development"],["AMACS-CAP-000140","Machine learning model implementation"],["AMACS-CAP-000141","Robotic process automation"],["AMACS-CAP-000142","Internet of Things integration"],["AMACS-CAP-000143","Digital twin implementation"]]}]}
