{"domain_id":"AMACS-DOM-000012","label":"Agriculture, Natural Resources and Marine","definition":"Agriculture, forestry, fisheries, marine, landscaping, and natural-resource operations.","families":[{"family_id":"AMACS-FAM-000448","label":"Crop and Horticultural Services","capabilities":[["AMACS-CAP-000449","Crop production support"],["AMACS-CAP-000450","Greenhouse operations"],["AMACS-CAP-000451","Nursery production"],["AMACS-CAP-000452","Irrigation services"],["AMACS-CAP-000453","Agricultural consulting"]]},{"family_id":"AMACS-FAM-000454","label":"Forestry and Land Management","capabilities":[["AMACS-CAP-000455","Forestry services"],["AMACS-CAP-000456","Tree care"],["AMACS-CAP-000457","Vegetation management"],["AMACS-CAP-000458","Land conservation services"],["AMACS-CAP-000459","Prescribed land management"]]},{"family_id":"AMACS-FAM-000460","label":"Marine and Maritime Services","capabilities":[["AMACS-CAP-000461","Marine vessel repair"],["AMACS-CAP-000462","Marine construction support"],["AMACS-CAP-000463","Commercial diving"],["AMACS-CAP-000464","Marina services"],["AMACS-CAP-000465","Marine survey services"]]},{"family_id":"AMACS-FAM-000466","label":"Fisheries and Aquaculture","capabilities":[["AMACS-CAP-000467","Aquaculture operations"],["AMACS-CAP-000468","Seafood handling"],["AMACS-CAP-000469","Fisheries consulting"],["AMACS-CAP-000470","Marine resource monitoring"],["AMACS-CAP-000471","Seafood processing"]]},{"family_id":"AMACS-FAM-000472","label":"Landscape and Outdoor Services","capabilities":[["AMACS-CAP-000473","Landscape installation"],["AMACS-CAP-000474","Landscape maintenance"],["AMACS-CAP-000475","Arboriculture"],["AMACS-CAP-000476","Erosion control"],["AMACS-CAP-000477","Outdoor recreation site maintenance"]]}]}
