{"domain_id":"AMACS-DOM-000004","label":"Professional and Business Services","definition":"Advisory, administrative, operational, compliance, and management services for organizations.","families":[{"family_id":"AMACS-FAM-000144","label":"Strategy and Management Consulting","capabilities":[["AMACS-CAP-000145","Strategic planning"],["AMACS-CAP-000146","Business process improvement"],["AMACS-CAP-000147","Organizational assessment"],["AMACS-CAP-000148","Operating model design"],["AMACS-CAP-000149","Performance management"],["AMACS-CAP-000150","Change management"]]},{"family_id":"AMACS-FAM-000151","label":"Accounting and Financial Management","capabilities":[["AMACS-CAP-000152","Bookkeeping"],["AMACS-CAP-000153","Financial statement preparation"],["AMACS-CAP-000154","Management accounting"],["AMACS-CAP-000155","Budget development"],["AMACS-CAP-000156","Cash-flow forecasting"],["AMACS-CAP-000157","Cost accounting"]]},{"family_id":"AMACS-FAM-000158","label":"Legal and Compliance Support","capabilities":[["AMACS-CAP-000159","Commercial legal services"],["AMACS-CAP-000160","Contract review support"],["AMACS-CAP-000161","Regulatory compliance consulting"],["AMACS-CAP-000162","Policy development"],["AMACS-CAP-000163","Records management"],["AMACS-CAP-000164","Privacy program support"]]},{"family_id":"AMACS-FAM-000165","label":"Human Resources","capabilities":[["AMACS-CAP-000166","Human resources consulting"],["AMACS-CAP-000167","Recruiting and talent acquisition"],["AMACS-CAP-000168","Compensation analysis"],["AMACS-CAP-000169","Employee handbook development"],["AMACS-CAP-000170","Workforce policy development"],["AMACS-CAP-000171","HR information system implementation"]]},{"family_id":"AMACS-FAM-000172","label":"Project and Program Management","capabilities":[["AMACS-CAP-000173","Project management"],["AMACS-CAP-000174","Program management"],["AMACS-CAP-000175","Project controls"],["AMACS-CAP-000176","Schedule management"],["AMACS-CAP-000177","Risk management"],["AMACS-CAP-000178","Portfolio management"]]},{"family_id":"AMACS-FAM-000179","label":"Administrative and Office Services","capabilities":[["AMACS-CAP-000180","Virtual administrative support"],["AMACS-CAP-000181","Document preparation"],["AMACS-CAP-000182","Meeting and event administration"],["AMACS-CAP-000183","Data entry"],["AMACS-CAP-000184","Call center services"],["AMACS-CAP-000185","Mail and fulfillment administration"]]},{"family_id":"AMACS-FAM-000186","label":"Procurement and Supply Management","capabilities":[["AMACS-CAP-000187","Procurement consulting"],["AMACS-CAP-000188","Strategic sourcing"],["AMACS-CAP-000189","Supplier management"],["AMACS-CAP-000190","Contract administration"],["AMACS-CAP-000191","Spend analysis"],["AMACS-CAP-000192","Supply chain risk assessment"]]}]}
