{"domain_id":"AMACS-DOM-000002","label":"Manufacturing and Production","definition":"Production, fabrication, assembly, processing, packaging, and industrial operations.","families":[{"family_id":"AMACS-FAM-000055","label":"Metal Fabrication","capabilities":[["AMACS-CAP-000056","Precision machining"],["AMACS-CAP-000057","Sheet-metal fabrication"],["AMACS-CAP-000058","Structural steel fabrication"],["AMACS-CAP-000059","Welding and joining"],["AMACS-CAP-000060","Metal finishing"],["AMACS-CAP-000061","Tool and die production"]]},{"family_id":"AMACS-FAM-000062","label":"Plastics and Composites","capabilities":[["AMACS-CAP-000063","Plastic injection molding"],["AMACS-CAP-000064","Thermoforming"],["AMACS-CAP-000065","Composite fabrication"],["AMACS-CAP-000066","Extrusion processing"],["AMACS-CAP-000067","Plastic component assembly"]]},{"family_id":"AMACS-FAM-000068","label":"Electronics and Electrical Manufacturing","capabilities":[["AMACS-CAP-000069","Printed circuit board assembly"],["AMACS-CAP-000070","Cable and wire harness assembly"],["AMACS-CAP-000071","Electronic enclosure manufacturing"],["AMACS-CAP-000072","Control panel fabrication"],["AMACS-CAP-000073","Electromechanical assembly"]]},{"family_id":"AMACS-FAM-000074","label":"Industrial Equipment and Machinery","capabilities":[["AMACS-CAP-000075","Custom machinery fabrication"],["AMACS-CAP-000076","Industrial equipment assembly"],["AMACS-CAP-000077","Machine rebuilding"],["AMACS-CAP-000078","Industrial maintenance support"],["AMACS-CAP-000079","Production line integration"]]},{"family_id":"AMACS-FAM-000080","label":"Packaging and Labeling","capabilities":[["AMACS-CAP-000081","Protective packaging design"],["AMACS-CAP-000082","Contract packaging"],["AMACS-CAP-000083","Product labeling"],["AMACS-CAP-000084","Corrugated packaging production"],["AMACS-CAP-000085","Flexible packaging production"]]},{"family_id":"AMACS-FAM-000086","label":"Quality and Production Systems","capabilities":[["AMACS-CAP-000087","Quality management system implementation"],["AMACS-CAP-000088","Production process improvement"],["AMACS-CAP-000089","Supplier quality assurance"],["AMACS-CAP-000090","Metrology and calibration"],["AMACS-CAP-000091","Lean manufacturing support"]]},{"family_id":"AMACS-FAM-000092","label":"Food and Beverage Production","capabilities":[["AMACS-CAP-000093","Food product manufacturing"],["AMACS-CAP-000094","Beverage production"],["AMACS-CAP-000095","Commercial baking"],["AMACS-CAP-000096","Specialty food processing"],["AMACS-CAP-000097","Cold-chain packaging"]]}]}
