{"domain_id":"AMACS-DOM-000015","label":"Real Estate, Site Selection and Economic Development","definition":"Property, location, site readiness, business attraction, expansion, and economic-development services.","families":[{"family_id":"AMACS-FAM-000546","label":"Commercial Real Estate Services","capabilities":[["AMACS-CAP-000547","Commercial brokerage"],["AMACS-CAP-000548","Tenant representation"],["AMACS-CAP-000549","Landlord representation"],["AMACS-CAP-000550","Property management"],["AMACS-CAP-000551","Lease advisory"],["AMACS-CAP-000552","Real estate valuation"]]},{"family_id":"AMACS-FAM-000553","label":"Site Selection Advisory","capabilities":[["AMACS-CAP-000554","Location strategy"],["AMACS-CAP-000555","Site search and screening"],["AMACS-CAP-000556","Community comparison"],["AMACS-CAP-000557","Site due diligence"],["AMACS-CAP-000558","Operating cost analysis"],["AMACS-CAP-000559","Site selection project management"]]},{"family_id":"AMACS-FAM-000560","label":"Site and Property Readiness","capabilities":[["AMACS-CAP-000561","Site readiness assessment"],["AMACS-CAP-000562","Property data development"],["AMACS-CAP-000563","Site certification support"],["AMACS-CAP-000564","Infrastructure readiness analysis"],["AMACS-CAP-000565","Development feasibility analysis"]]},{"family_id":"AMACS-FAM-000566","label":"Economic Development Services","capabilities":[["AMACS-CAP-000567","Business attraction support"],["AMACS-CAP-000568","Business retention and expansion support"],["AMACS-CAP-000569","Supplier development"],["AMACS-CAP-000570","Industry cluster analysis"],["AMACS-CAP-000571","Economic development strategy"],["AMACS-CAP-000572","Business visitation programs"]]},{"family_id":"AMACS-FAM-000573","label":"Incentives and Project Facilitation","capabilities":[["AMACS-CAP-000574","Incentive negotiation support"],["AMACS-CAP-000575","Incentive compliance management"],["AMACS-CAP-000576","Permitting coordination"],["AMACS-CAP-000577","Project facilitation"],["AMACS-CAP-000578","Community response coordination"]]},{"family_id":"AMACS-FAM-000579","label":"Workforce and Location Intelligence","capabilities":[["AMACS-CAP-000580","Labor market analysis"],["AMACS-CAP-000581","Workforce availability analysis"],["AMACS-CAP-000582","Commuting pattern analysis"],["AMACS-CAP-000583","Demographic analysis"],["AMACS-CAP-000584","Location benchmarking"]]}]}
