{"domain_id":"AMACS-DOM-000013","label":"Public Administration and Civic Services","definition":"Government-support, civic engagement, public safety, elections, planning, and public-service operations.","families":[{"family_id":"AMACS-FAM-000478","label":"Public Administration Support","capabilities":[["AMACS-CAP-000479","Government program administration"],["AMACS-CAP-000480","Public records support"],["AMACS-CAP-000481","Grant program administration"],["AMACS-CAP-000482","Public meeting administration"],["AMACS-CAP-000483","Regulatory program support"]]},{"family_id":"AMACS-FAM-000484","label":"Community Engagement","capabilities":[["AMACS-CAP-000485","Public engagement facilitation"],["AMACS-CAP-000486","Stakeholder engagement"],["AMACS-CAP-000487","Community survey design"],["AMACS-CAP-000488","Public meeting facilitation"],["AMACS-CAP-000489","Civic outreach"]]},{"family_id":"AMACS-FAM-000490","label":"Emergency and Public Safety Support","capabilities":[["AMACS-CAP-000491","Emergency planning"],["AMACS-CAP-000492","Disaster recovery support"],["AMACS-CAP-000493","Emergency logistics"],["AMACS-CAP-000494","Public safety communications support"],["AMACS-CAP-000495","Continuity of government planning"]]},{"family_id":"AMACS-FAM-000496","label":"Planning and Policy","capabilities":[["AMACS-CAP-000497","Comprehensive planning"],["AMACS-CAP-000498","Economic policy analysis"],["AMACS-CAP-000499","Transportation planning"],["AMACS-CAP-000500","Housing policy analysis"],["AMACS-CAP-000501","Community development planning"]]},{"family_id":"AMACS-FAM-000502","label":"Election and Civic Process Support","capabilities":[["AMACS-CAP-000503","Election logistics support"],["AMACS-CAP-000504","Voter outreach support"],["AMACS-CAP-000505","Polling place accessibility support"],["AMACS-CAP-000506","Civic education"],["AMACS-CAP-000507","Election technology support"]]}]}
