{"domain_id":"AMACS-DOM-000005","label":"Logistics, Transportation and Warehousing","definition":"Movement, storage, distribution, delivery, and logistics coordination of goods and people.","families":[{"family_id":"AMACS-FAM-000193","label":"Freight Transportation","capabilities":[["AMACS-CAP-000194","Truckload freight transportation"],["AMACS-CAP-000195","Less-than-truckload transportation"],["AMACS-CAP-000196","Expedited freight transportation"],["AMACS-CAP-000197","Intermodal freight coordination"],["AMACS-CAP-000198","Specialized freight transportation"]]},{"family_id":"AMACS-FAM-000199","label":"Warehousing and Distribution","capabilities":[["AMACS-CAP-000200","Warehousing"],["AMACS-CAP-000201","Inventory management"],["AMACS-CAP-000202","Order fulfillment"],["AMACS-CAP-000203","Cross-docking"],["AMACS-CAP-000204","Distribution center operations"],["AMACS-CAP-000205","Cold storage"]]},{"family_id":"AMACS-FAM-000206","label":"Courier and Last-Mile Delivery","capabilities":[["AMACS-CAP-000207","Local courier service"],["AMACS-CAP-000208","Last-mile delivery"],["AMACS-CAP-000209","Scheduled route delivery"],["AMACS-CAP-000210","Medical courier service"],["AMACS-CAP-000211","Document delivery"]]},{"family_id":"AMACS-FAM-000212","label":"Logistics Management","capabilities":[["AMACS-CAP-000213","Logistics planning"],["AMACS-CAP-000214","Transportation management"],["AMACS-CAP-000215","Route optimization"],["AMACS-CAP-000216","Freight brokerage"],["AMACS-CAP-000217","Third-party logistics management"]]},{"family_id":"AMACS-FAM-000218","label":"Passenger Transportation","capabilities":[["AMACS-CAP-000219","Charter transportation"],["AMACS-CAP-000220","Shuttle service"],["AMACS-CAP-000221","Non-emergency medical transportation"],["AMACS-CAP-000222","Employee transportation"],["AMACS-CAP-000223","Accessible transportation"]]},{"family_id":"AMACS-FAM-000224","label":"Fleet Services","capabilities":[["AMACS-CAP-000225","Fleet maintenance"],["AMACS-CAP-000226","Fleet management"],["AMACS-CAP-000227","Vehicle upfitting"],["AMACS-CAP-000228","Mobile repair service"],["AMACS-CAP-000229","Fleet telematics implementation"]]}]}
