{"domain_id":"AMACS-DOM-000001","label":"Built Environment and Facilities","definition":"Construction, installation, maintenance, repair, and operation of buildings, sites, and physical facilities.","families":[{"family_id":"AMACS-FAM-000001","label":"General Construction and Renovation","capabilities":[["AMACS-CAP-000002","General contracting"],["AMACS-CAP-000003","Commercial renovation"],["AMACS-CAP-000004","Tenant improvement"],["AMACS-CAP-000005","Design-build construction"],["AMACS-CAP-000006","Construction project management"],["AMACS-CAP-000007","Historic building rehabilitation"]]},{"family_id":"AMACS-FAM-000008","label":"Electrical Systems","capabilities":[["AMACS-CAP-000009","Commercial electrical installation"],["AMACS-CAP-000010","Electrical inspection and testing"],["AMACS-CAP-000011","Lighting systems installation"],["AMACS-CAP-000012","Building controls integration"],["AMACS-CAP-000013","Emergency power systems"],["AMACS-CAP-000014","Low-voltage systems installation"]]},{"family_id":"AMACS-FAM-000015","label":"Mechanical and HVAC Systems","capabilities":[["AMACS-CAP-000016","HVAC installation"],["AMACS-CAP-000017","HVAC preventive maintenance"],["AMACS-CAP-000018","Building automation commissioning"],["AMACS-CAP-000019","Boiler and chiller service"],["AMACS-CAP-000020","Refrigeration service"],["AMACS-CAP-000021","Indoor air quality assessment"]]},{"family_id":"AMACS-FAM-000022","label":"Plumbing and Water Systems","capabilities":[["AMACS-CAP-000023","Commercial plumbing installation"],["AMACS-CAP-000024","Plumbing repair and maintenance"],["AMACS-CAP-000025","Backflow prevention service"],["AMACS-CAP-000026","Water-efficiency retrofit"],["AMACS-CAP-000027","Fire-suppression piping service"]]},{"family_id":"AMACS-FAM-000028","label":"Facilities Operations","capabilities":[["AMACS-CAP-000029","Integrated facilities management"],["AMACS-CAP-000030","Preventive maintenance program management"],["AMACS-CAP-000031","Janitorial services"],["AMACS-CAP-000032","Grounds maintenance"],["AMACS-CAP-000033","Building condition assessment"],["AMACS-CAP-000034","Work-order management"]]},{"family_id":"AMACS-FAM-000035","label":"Civil and Site Work","capabilities":[["AMACS-CAP-000036","Site preparation"],["AMACS-CAP-000037","Excavation and grading"],["AMACS-CAP-000038","Concrete construction"],["AMACS-CAP-000039","Paving and pavement repair"],["AMACS-CAP-000040","Stormwater infrastructure construction"],["AMACS-CAP-000041","Utility trenching"]]},{"family_id":"AMACS-FAM-000042","label":"Roofing and Building Envelope","capabilities":[["AMACS-CAP-000043","Commercial roofing installation"],["AMACS-CAP-000044","Roof inspection and repair"],["AMACS-CAP-000045","Waterproofing"],["AMACS-CAP-000046","Masonry restoration"],["AMACS-CAP-000047","Window and glazing installation"],["AMACS-CAP-000048","Building-envelope assessment"]]},{"family_id":"AMACS-FAM-000049","label":"Safety and Security Systems","capabilities":[["AMACS-CAP-000050","Fire alarm installation"],["AMACS-CAP-000051","Access-control system installation"],["AMACS-CAP-000052","Video surveillance installation"],["AMACS-CAP-000053","Life-safety system inspection"],["AMACS-CAP-000054","Security system integration"]]}]}
