{"domain_id":"AMACS-DOM-000008","label":"Education, Training and Workforce","definition":"Education, instruction, workforce development, skills, and talent-pipeline services.","families":[{"family_id":"AMACS-FAM-000304","label":"Corporate and Professional Training","capabilities":[["AMACS-CAP-000305","Leadership development training"],["AMACS-CAP-000306","Supervisory training"],["AMACS-CAP-000307","Customer service training"],["AMACS-CAP-000308","Compliance training"],["AMACS-CAP-000309","Project management training"],["AMACS-CAP-000310","Digital skills training"]]},{"family_id":"AMACS-FAM-000311","label":"Technical and Skilled Trades Training","capabilities":[["AMACS-CAP-000312","Electrical trades training"],["AMACS-CAP-000313","Construction trades training"],["AMACS-CAP-000314","Manufacturing skills training"],["AMACS-CAP-000315","Logistics training"],["AMACS-CAP-000316","Equipment operator training"]]},{"family_id":"AMACS-FAM-000317","label":"Workforce Development Services","capabilities":[["AMACS-CAP-000318","Employer workforce services"],["AMACS-CAP-000319","Workforce needs assessment"],["AMACS-CAP-000320","Job placement support"],["AMACS-CAP-000321","Apprenticeship program development"],["AMACS-CAP-000322","Incumbent worker training coordination"]]},{"family_id":"AMACS-FAM-000323","label":"Curriculum and Instructional Design","capabilities":[["AMACS-CAP-000324","Curriculum development"],["AMACS-CAP-000325","Instructional design"],["AMACS-CAP-000326","E-learning development"],["AMACS-CAP-000327","Assessment design"],["AMACS-CAP-000328","Training facilitation"]]},{"family_id":"AMACS-FAM-000329","label":"Education Support Services","capabilities":[["AMACS-CAP-000330","Tutoring"],["AMACS-CAP-000331","Academic advising"],["AMACS-CAP-000332","Student support services"],["AMACS-CAP-000333","Career coaching"],["AMACS-CAP-000334","Learning program evaluation"]]},{"family_id":"AMACS-FAM-000335","label":"Credentialing and Testing","capabilities":[["AMACS-CAP-000336","Certification exam administration"],["AMACS-CAP-000337","Skills assessment"],["AMACS-CAP-000338","Prior learning assessment"],["AMACS-CAP-000339","Credential program design"],["AMACS-CAP-000340","Proctoring services"]]}]}
