{"domain_id":"AMACS-DOM-000007","label":"Health, Human and Community Services","definition":"Health, wellness, social, behavioral, care, and community-based services.","families":[{"family_id":"AMACS-FAM-000267","label":"Clinical and Allied Health Services","capabilities":[["AMACS-CAP-000268","Primary care services"],["AMACS-CAP-000269","Nursing services"],["AMACS-CAP-000270","Physical therapy"],["AMACS-CAP-000271","Occupational therapy"],["AMACS-CAP-000272","Behavioral health counseling"],["AMACS-CAP-000273","Mobile health services"]]},{"family_id":"AMACS-FAM-000274","label":"Home and Community-Based Care","capabilities":[["AMACS-CAP-000275","Home health support"],["AMACS-CAP-000276","Personal care services"],["AMACS-CAP-000277","Senior support services"],["AMACS-CAP-000278","Respite care"],["AMACS-CAP-000279","Care coordination"]]},{"family_id":"AMACS-FAM-000280","label":"Social and Family Services","capabilities":[["AMACS-CAP-000281","Case management"],["AMACS-CAP-000282","Family support services"],["AMACS-CAP-000283","Youth development services"],["AMACS-CAP-000284","Housing stabilization services"],["AMACS-CAP-000285","Community outreach"]]},{"family_id":"AMACS-FAM-000286","label":"Public Health Support","capabilities":[["AMACS-CAP-000287","Health education"],["AMACS-CAP-000288","Community health assessment"],["AMACS-CAP-000289","Disease prevention outreach"],["AMACS-CAP-000290","Emergency public health support"],["AMACS-CAP-000291","Health data analysis"]]},{"family_id":"AMACS-FAM-000292","label":"Wellness and Fitness","capabilities":[["AMACS-CAP-000293","Workplace wellness programs"],["AMACS-CAP-000294","Fitness instruction"],["AMACS-CAP-000295","Nutrition education"],["AMACS-CAP-000296","Stress management programs"],["AMACS-CAP-000297","Health coaching"]]},{"family_id":"AMACS-FAM-000298","label":"Accessibility and Inclusion Services","capabilities":[["AMACS-CAP-000299","Disability inclusion consulting"],["AMACS-CAP-000300","Sign language interpretation"],["AMACS-CAP-000301","Assistive technology support"],["AMACS-CAP-000302","Accessibility program design"],["AMACS-CAP-000303","Language access coordination"]]}]}
