{"domain_id":"AMACS-DOM-000010","label":"Marketing, Media and Creative Services","definition":"Brand, communication, promotion, content, media, design, and audience-development services.","families":[{"family_id":"AMACS-FAM-000378","label":"Brand and Marketing Strategy","capabilities":[["AMACS-CAP-000379","Brand strategy"],["AMACS-CAP-000380","Marketing strategy"],["AMACS-CAP-000381","Market positioning"],["AMACS-CAP-000382","Customer segmentation"],["AMACS-CAP-000383","Campaign planning"],["AMACS-CAP-000384","Marketing analytics"]]},{"family_id":"AMACS-FAM-000385","label":"Graphic and Visual Design","capabilities":[["AMACS-CAP-000386","Graphic design"],["AMACS-CAP-000387","Publication design"],["AMACS-CAP-000388","Presentation design"],["AMACS-CAP-000389","Information design"],["AMACS-CAP-000390","Packaging design"],["AMACS-CAP-000391","Environmental graphic design"]]},{"family_id":"AMACS-FAM-000392","label":"Digital Marketing","capabilities":[["AMACS-CAP-000393","Search engine optimization"],["AMACS-CAP-000394","Paid media management"],["AMACS-CAP-000395","Email marketing"],["AMACS-CAP-000396","Social media management"],["AMACS-CAP-000397","Marketing automation"],["AMACS-CAP-000398","Conversion optimization"]]},{"family_id":"AMACS-FAM-000399","label":"Content and Communications","capabilities":[["AMACS-CAP-000400","Copywriting"],["AMACS-CAP-000401","Technical writing"],["AMACS-CAP-000402","Public relations"],["AMACS-CAP-000403","Media relations"],["AMACS-CAP-000404","Internal communications"],["AMACS-CAP-000405","Content strategy"]]},{"family_id":"AMACS-FAM-000406","label":"Photography and Video","capabilities":[["AMACS-CAP-000407","Commercial photography"],["AMACS-CAP-000408","Video production"],["AMACS-CAP-000409","Video editing"],["AMACS-CAP-000410","Animation and motion graphics"],["AMACS-CAP-000411","Aerial imaging"]]},{"family_id":"AMACS-FAM-000412","label":"Events and Experiences","capabilities":[["AMACS-CAP-000413","Event planning"],["AMACS-CAP-000414","Conference production"],["AMACS-CAP-000415","Trade show support"],["AMACS-CAP-000416","Experiential marketing"],["AMACS-CAP-000417","Venue coordination"]]}]}
