{"domain_id":"AMACS-DOM-000016","label":"Standards, Taxonomy and Market Architecture","definition":"Design, governance, mapping, architecture, licensing, and technical delivery of controlled classifications and market-operating languages used to connect needs, capabilities, evidence, responses, decisions, and outcomes.","version_introduced":"0.2.0","source_origin":"original_amacs","status":"active","editorial_maturity":"reviewed","families":[{"family_id":"AMACS-FAM-000585","label":"Standards and Taxonomy Engineering","definition":"Development, governance, and mapping of controlled classification systems, standards, and semantic market structures.","status":"active","editorial_maturity":"reviewed","capabilities":[{"capability_id":"AMACS-CAP-000586","label":"Taxonomy development","definition":"The organizational ability to design, document, maintain, and version structured classification systems, including hierarchies, identifiers, preferred labels, definitions, relationships, and editorial rules.","status":"active","editorial_maturity":"reviewed"},{"capability_id":"AMACS-CAP-000587","label":"Standards governance","definition":"The organizational ability to establish and administer authority, review, change control, release, integrity, conflict, and stakeholder-participation rules for a governed standard.","status":"active","editorial_maturity":"reviewed"},{"capability_id":"AMACS-CAP-000588","label":"Capability mapping","definition":"The organizational ability to map market needs, organizational abilities, and external classifications to controlled capability concepts while preserving scope, provenance, confidence, and semantic relationships.","status":"active","editorial_maturity":"reviewed"}]},{"family_id":"AMACS-FAM-000589","label":"Evidence, Response and Decision Architecture","definition":"Design of structured evidence, response, and evaluation systems that connect requirements to submissions and transparent decisions.","status":"active","editorial_maturity":"reviewed","capabilities":[{"capability_id":"AMACS-CAP-000590","label":"Evidence architecture","definition":"The organizational ability to design structured evidence, credential, verification, provenance, recency, sufficiency, and coverage models used to establish fitness, eligibility, or compliance.","status":"active","editorial_maturity":"reviewed"},{"capability_id":"AMACS-CAP-000591","label":"Response architecture","definition":"The organizational ability to design reusable response sections, templates, instructions, dependencies, and data structures that govern how market participants answer requests.","status":"active","editorial_maturity":"reviewed"},{"capability_id":"AMACS-CAP-000592","label":"Decision architecture","definition":"The organizational ability to design gates, scored factors, weights, formulas, evidence links, and decision rules used to evaluate alternatives transparently and consistently.","status":"active","editorial_maturity":"reviewed"}]},{"family_id":"AMACS-FAM-000593","label":"Standards Licensing and Technical Delivery","definition":"Commercial licensing and machine-readable delivery of governed taxonomies, schemas, releases, mappings, and validation services.","status":"active","editorial_maturity":"reviewed","capabilities":[{"capability_id":"AMACS-CAP-000594","label":"Controlled taxonomy licensing","definition":"The organizational ability to license governed taxonomy content, schemas, releases, and permitted derivative uses under defined rights, restrictions, attribution, version, and distribution terms.","status":"active","editorial_maturity":"reviewed"},{"capability_id":"AMACS-CAP-000595","label":"Taxonomy API delivery","definition":"The organizational ability to provide versioned taxonomy, mapping, search, validation, and release data through documented application programming interfaces or other machine-readable delivery services.","status":"active","editorial_maturity":"reviewed"}]}]}
